{"$schema":"https://json-schema.org/draft/2020-12/schema","additionalProperties":false,"properties":{"actions":{"minItems":1,"type":"array"},"adapter":{"type":"object"},"authorizationId":{"const":"phase-4/v1"},"fixtures":{"minItems":10,"type":"array"},"operationFamilies":{"type":"array"},"registryVersion":{"const":4},"specId":{"const":"SPEC-0001"}},"required":["registryVersion","specId","authorizationId","operationFamilies","adapter","fixtures","actions"],"type":"object"}
