{
  "registryVersion": 4,
  "specId": "SPEC-0001",
  "authorizationId": "phase-4/v1",
  "operationFamilies": [
    "checkpoint",
    "fixture",
    "pointer",
    "protected-regression",
    "runner-environment",
    "screenshot",
    "visible-role",
    "visible-testid",
    "workspace-driver"
  ],
  "adapter": {
    "path": "scripts/spec0001-browser/actions/phase4.ts",
    "byteLength": 2086,
    "sha256": "sha256:2add3f848ac59cb6c64389468026edad531dbda87129308abdca08017f37be5c"
  },
  "fixtures": [
    {"fixtureId":"transaction-request","fixtureKind":"stick-active-request-v1","sourceKind":"repository-json","binding":{"path":"scripts/fixtures/stick-ai/v1/stick-command-transaction-cases.json","byteLength":5970,"sha256":"sha256:dff59da7eb5bc4a1b97d00b783291305bf14a0340c2a43382a8185bc6f6c05ca"},"expectedFixtureDigest":"sha256:dff59da7eb5bc4a1b97d00b783291305bf14a0340c2a43382a8185bc6f6c05ca"},
    {"fixtureId":"transaction-abort","fixtureKind":"stick-request-abort-v1","sourceKind":"repository-json","binding":{"path":"scripts/fixtures/stick-ai/v1/stick-command-transaction-cases.json","byteLength":5970,"sha256":"sha256:dff59da7eb5bc4a1b97d00b783291305bf14a0340c2a43382a8185bc6f6c05ca"},"expectedFixtureDigest":"sha256:dff59da7eb5bc4a1b97d00b783291305bf14a0340c2a43382a8185bc6f6c05ca"},
    {"fixtureId":"transaction-preview","fixtureKind":"stick-command-envelope-v1","sourceKind":"repository-json","binding":{"path":"scripts/fixtures/stick-ai/v1/stick-command-transaction-cases.json","byteLength":5970,"sha256":"sha256:dff59da7eb5bc4a1b97d00b783291305bf14a0340c2a43382a8185bc6f6c05ca"},"expectedFixtureDigest":"sha256:dff59da7eb5bc4a1b97d00b783291305bf14a0340c2a43382a8185bc6f6c05ca"},
    {"fixtureId":"transaction-cancel","fixtureKind":"stick-preview-cancel-v1","sourceKind":"repository-json","binding":{"path":"scripts/fixtures/stick-ai/v1/stick-command-transaction-cases.json","byteLength":5970,"sha256":"sha256:dff59da7eb5bc4a1b97d00b783291305bf14a0340c2a43382a8185bc6f6c05ca"},"expectedFixtureDigest":"sha256:dff59da7eb5bc4a1b97d00b783291305bf14a0340c2a43382a8185bc6f6c05ca"},
    {"fixtureId":"transaction-apply","fixtureKind":"stick-command-apply-v1","sourceKind":"repository-json","binding":{"path":"scripts/fixtures/stick-ai/v1/stick-command-transaction-cases.json","byteLength":5970,"sha256":"sha256:dff59da7eb5bc4a1b97d00b783291305bf14a0340c2a43382a8185bc6f6c05ca"},"expectedFixtureDigest":"sha256:dff59da7eb5bc4a1b97d00b783291305bf14a0340c2a43382a8185bc6f6c05ca"},
    {"fixtureId":"transaction-redelivery","fixtureKind":"stick-command-redelivery-v1","sourceKind":"repository-json","binding":{"path":"scripts/fixtures/stick-ai/v1/stick-command-transaction-cases.json","byteLength":5970,"sha256":"sha256:dff59da7eb5bc4a1b97d00b783291305bf14a0340c2a43382a8185bc6f6c05ca"},"expectedFixtureDigest":"sha256:dff59da7eb5bc4a1b97d00b783291305bf14a0340c2a43382a8185bc6f6c05ca"},
    {"fixtureId":"transaction-failure","fixtureKind":"stick-injected-transaction-failure-v1","sourceKind":"repository-json","binding":{"path":"scripts/fixtures/stick-ai/v1/stick-command-transaction-cases.json","byteLength":5970,"sha256":"sha256:dff59da7eb5bc4a1b97d00b783291305bf14a0340c2a43382a8185bc6f6c05ca"},"expectedFixtureDigest":"sha256:dff59da7eb5bc4a1b97d00b783291305bf14a0340c2a43382a8185bc6f6c05ca"},
    {"fixtureId":"transaction-visible-failure","fixtureKind":"stick-next-visible-apply-failure-v1","sourceKind":"repository-json","binding":{"path":"scripts/fixtures/stick-ai/v1/stick-command-transaction-cases.json","byteLength":5970,"sha256":"sha256:dff59da7eb5bc4a1b97d00b783291305bf14a0340c2a43382a8185bc6f6c05ca"},"expectedFixtureDigest":"sha256:dff59da7eb5bc4a1b97d00b783291305bf14a0340c2a43382a8185bc6f6c05ca"},
    {"fixtureId":"project-eligible-history-root","fixtureKind":"stick-workspace-history-mount-v1","sourceKind":"repository-json","binding":{"path":"scripts/fixtures/stick-ai/v1/stick-command-transaction-cases.json","byteLength":5970,"sha256":"sha256:dff59da7eb5bc4a1b97d00b783291305bf14a0340c2a43382a8185bc6f6c05ca"},"expectedFixtureDigest":"sha256:dff59da7eb5bc4a1b97d00b783291305bf14a0340c2a43382a8185bc6f6c05ca"},
    {"fixtureId":"publication-begin","fixtureKind":"stick-command-apply-publication-plan-v1","sourceKind":"repository-json","binding":{"path":"scripts/fixtures/stick-ai/v1/stick-command-publication-race-cases.json","byteLength":2565,"sha256":"sha256:c13b6ca5b50132c4456b7538fb8a7f4c59387bddd62c5ab2d6e0a1e4ad294097"},"expectedFixtureDigest":"sha256:c13b6ca5b50132c4456b7538fb8a7f4c59387bddd62c5ab2d6e0a1e4ad294097"},
    {"fixtureId":"publication-complete","fixtureKind":"stick-command-apply-publication-completion-v1","sourceKind":"repository-json","binding":{"path":"scripts/fixtures/stick-ai/v1/stick-command-publication-race-cases.json","byteLength":2565,"sha256":"sha256:c13b6ca5b50132c4456b7538fb8a7f4c59387bddd62c5ab2d6e0a1e4ad294097"},"expectedFixtureDigest":"sha256:c13b6ca5b50132c4456b7538fb8a7f4c59387bddd62c5ab2d6e0a1e4ad294097"},
    {"fixtureId":"publication-redelivery","fixtureKind":"stick-command-redelivery-v1","sourceKind":"repository-json","binding":{"path":"scripts/fixtures/stick-ai/v1/stick-command-publication-race-cases.json","byteLength":2565,"sha256":"sha256:c13b6ca5b50132c4456b7538fb8a7f4c59387bddd62c5ab2d6e0a1e4ad294097"},"expectedFixtureDigest":"sha256:c13b6ca5b50132c4456b7538fb8a7f4c59387bddd62c5ab2d6e0a1e4ad294097"},
    {"fixtureId":"project-mounted-open-candidate","fixtureKind":"stick-mounted-open-candidate-v1","sourceKind":"repository-json","binding":{"path":"scripts/fixtures/stick-ai/v1/stick-command-publication-race-cases.json","byteLength":2565,"sha256":"sha256:c13b6ca5b50132c4456b7538fb8a7f4c59387bddd62c5ab2d6e0a1e4ad294097"},"expectedFixtureDigest":"sha256:c13b6ca5b50132c4456b7538fb8a7f4c59387bddd62c5ab2d6e0a1e4ad294097"},
    {"fixtureId":"project-mounted-open-completion","fixtureKind":"stick-mounted-open-completion-v1","sourceKind":"repository-json","binding":{"path":"scripts/fixtures/stick-ai/v1/stick-command-publication-race-cases.json","byteLength":2565,"sha256":"sha256:c13b6ca5b50132c4456b7538fb8a7f4c59387bddd62c5ab2d6e0a1e4ad294097"},"expectedFixtureDigest":"sha256:c13b6ca5b50132c4456b7538fb8a7f4c59387bddd62c5ab2d6e0a1e4ad294097"}
  ],
  "actions": [
    {"actionId":"abort-request-start","family":"workspace-driver","operation":"beginStickRequest","fixtureId":"transaction-request","operationId":"request-main","expectedEvidenceDigest":"sha256:6c896b4eccc5e0b3f7caa454cc3d0f426e2077e837544f4f5a6cbeaf7c9a2551"},
    {"actionId":"abort-requesting-checkpoint","family":"workspace-driver","operation":"readCheckpoint","fixtureId":null,"operationId":"abort-requesting","expectedEvidenceDigest":"sha256:ee18729f24ed34a3766ff7cbbd5869e809b170fed8594980d28be2b6b77dc3d1"},
    {"actionId":"abort-request","family":"workspace-driver","operation":"abortStickRequest","fixtureId":"transaction-abort","operationId":"abort-main","expectedEvidenceDigest":"sha256:7f1878e8fc0bd8ce5d85567105512ea13d777926b07ad9b5b76ea9fe91e6dd83"},
    {"actionId":"abort-terminal-checkpoint","family":"workspace-driver","operation":"readCheckpoint","fixtureId":null,"operationId":"abort-terminal","expectedEvidenceDigest":"sha256:75dce31a7cb663d5e7f3b709f817ce466df66b3f98d94c0f05b65fdf6fb5ae3e"},

    {"actionId":"cancel-request-start","family":"workspace-driver","operation":"beginStickRequest","fixtureId":"transaction-request","operationId":"request-main","expectedEvidenceDigest":"sha256:0cd1f2b12be556fbbae22accf46b6e5beaae9c1285c5848f62000631d6ee1584"},
    {"actionId":"cancel-preview","family":"workspace-driver","operation":"previewStickCommand","fixtureId":"transaction-preview","operationId":"preview-main","expectedEvidenceDigest":"sha256:0f36d4c488331d723088d41c71e09bd25814b1e0d7d70740326727e69d0abd4a"},
    {"actionId":"cancel-preview-redelivery","family":"workspace-driver","operation":"redeliverStickCommand","fixtureId":"transaction-redelivery","operationId":"redelivery-main","expectedEvidenceDigest":"sha256:1725508878bab37a83b83169d81df9ae035ad0095645869c4127756f58a7a9be"},
    {"actionId":"cancel-preview-action","family":"workspace-driver","operation":"cancelStickPreview","fixtureId":"transaction-cancel","operationId":"cancel-main","expectedEvidenceDigest":"sha256:45c170be248b5c613145b295e479e84de99c4d70dd478bf2a1654974b7165bb8"},
    {"actionId":"cancel-terminal-redelivery","family":"workspace-driver","operation":"redeliverStickCommand","fixtureId":"transaction-redelivery","operationId":"redelivery-main","expectedEvidenceDigest":"sha256:a96c4541ec81f154fae41b285286e3d47feb26fdf8aeab5b3f210404d5a8a067"},
    {"actionId":"cancel-terminal-checkpoint","family":"workspace-driver","operation":"readCheckpoint","fixtureId":null,"operationId":"cancel-terminal","expectedEvidenceDigest":"sha256:60a6aa4ff6935167169394d07822928441234ade48d0cb6ff90965b13bfc1392"},

    {"actionId":"apply-request-start","family":"workspace-driver","operation":"beginStickRequest","fixtureId":"transaction-request","operationId":"request-main","expectedEvidenceDigest":"sha256:623d5abe6bfa83012c48bc710455bf31530269d5757326c0b165f181eb3cbcdc"},
    {"actionId":"apply-preview","family":"workspace-driver","operation":"previewStickCommand","fixtureId":"transaction-preview","operationId":"preview-main","expectedEvidenceDigest":"sha256:c60d076d1ccb87b6d70728622ae93c3c289395ee1334667270713a715a0e6d12"},
    {"actionId":"apply-command","family":"workspace-driver","operation":"applyStickCommand","fixtureId":"transaction-apply","operationId":"apply-main","expectedEvidenceDigest":"sha256:fdde48e386a8bee939d18fa886289c1e6717013da8e44a35de5e3fe5f89df881"},
    {"actionId":"apply-duplicate-redelivery","family":"workspace-driver","operation":"redeliverStickCommand","fixtureId":"transaction-redelivery","operationId":"redelivery-main","expectedEvidenceDigest":"sha256:e88732d75efa66af2be299e672e291b8e340dc215012397ae338a7d6dda9cf60"},